,full_text,tweet_english
0,pulang indomaret ehhh baru masuk sambut lagu ptd bangtan ssksksksk,go home indomaret ehhh just entered welcome the song ptd bangtan ssksksk
1,kacau enak banget air kelapa indomaret hydariococo tiati kata sayae,chaotic delicious coconut water indomaret hydariococo tiati said sayae
2,mau indomaret,want indomaret
3,iini mah keren banget udah gacor withdraw bayar kemaren pernah rungkad tetap puas main disiini soal layan raja mantap dah kaya apotek tutup soal gaada obat,iini mah really cool already gacor withdraw pay yesterday ever broken down still satisfied playing here about the king's service steady already rich pharmacy closed about gaada drug
4,aku kak kerja web ngehandle 2 project besar antara pi network sama hamster kombat udah cair dana indomaret,i work web ngehandle 2 big projects between pi network and hamster kombat already liquid funds indomaret
5,indomaret samping bapak bapak umur 60 an main slot co,indomaret beside father father age 60 play slot co
6,sedih gak bagi oiinigiri indomaret,sadly not for oiinigiri indomaret
7,indomaret kak,indomaret sis
8,aku lebih suka indomaret si,i prefer indomaret si
9,tanah jual pinggir laut desa lahokrukam kab aceh selatan kec tapaktuan tanah iini cocok buat lokasi market,land for sale seafront lahokrukam village south aceh district tapaktuan this land is suitable for market locations
10,pliss jangan ingetin insiden indomaret jebak ujan huhu,pliss do not ingetin incident indomaret trap ujan huhu
11,ir indomaret deket st bekas cuma stroberi leci sama anggur iini iw mana coba stroberi maiinis banget lagimending mangga leci,ir indomaret deket st used only strawberry lychee sama grape iini iw mana cuba strawberry maiinis sangatet lagimending mango lychee
12,indomaret deket kost nyata mogu mogu minwon,indomaret close to real boarding house mogu mogu minwon
13,karyawan alfamart sama karyawan indomaret kalau pacar ngga restu manajer cerita kaya romeo and juliet endingnya bukan minum racun makan barang barang ekspired,alfamart employees and indomaret employees if the boyfriend does not have the blessing of the manager of the rich story of Romeo and Juliet the ending is not drinking poison eating expired goods
14,main hutan kota gratis aja udah happy banget modal jajan indomaret jogging ragunan nongkrong sarinah mutermuter blok m murah banget asal lo ga gengsi makan a b c,play urban forest for free just because you're really happy with the snack capital indomaret jogging ragunan hang out sarinah mutermuter blok m really cheap origin lo ga prestige eat a b c
15,12rb kang parkir dada kalau naro motor depan indomaret holland biar ga kena parkir,12kb kang parking dada if naro motorbike in front of indomaret holland so it doesn't have to be parked
16,promo hemat banget indomaret 1319 juiini 2024,really economical promos indomaret 1319 juiini 2024
17,damn ga warung indomaret ssampai twt slalu dengar lihat iini lagu lejen wkekek,damn ga warung indomaret ssampai twt slalu hear see this song lejen wkekek
18,map ga gede retailer lokal asli indonesia kayak yogya group jawa barat aja punya brand coffee sendiri nama yo coffee indomaret punya brand coffee sendiri brand lokal iini struggle research sendiri buat sustain and survive,"map ga gede original Indonesian local retailer like yogya group, west Java has its own coffee brand, the name yo coffee indomaret has its own coffee brand, this local brand struggles to research itself to sustain and survive"
19,disuru beli makan se indomaret,bought to eat se indomaret
20,saro iinian rumah pelosok nak indomaret susah nak ngandelke uwg katek pck d andelke,saro iinian rustic house want indomaret hard to handle uwg catek pck d andelke
21,promo paling murah indomaret periode 1319 juiini 2024,indomaret cheapest promo period 1319 juiini 2024
22,ga mau mau kursi indomaret,i don't want an indomaret chair
23,coba jakarta giiniin dong soal nya tukang parkir gajelas indomaret kadang kadang liar jugaa suka godain cewe bikin risih aja,try jakarta giiniin dong about the parking lot gajelas indomaret sometimes sometimes wild alsoa likes to seduce girls to make you uncomfortable
24,ik iini tolol baring2 ka lihat tempat duduk samping indomaret baru datang kakek2 iini kakek2 na colek bahuku situ langsungka lihat menep baru napegang pantat langsungka menang baru pergi dari situ respon pertama memang kaya diam nda teriak,ikini silly baring2 ka see the side seat of indomaret just came grandparents iini grandparents na poke my shoulders there immediately see the new sideways napegang butt straight away win just go from there the first response is indeed rich silence nda scream
25,wkwkwkwkwkwkwk iya jir keinget pas ngejer kereta gambir gambeling turun cikiinigondangdia akhir pilih cikiini gt grab gt gambir udah mah waktu mepet bingung pager ijo keluar mana pas deket indomaret titik,wkwkwkwkwkwkwk yes jir keinget pas ngejer train gambir gambeling down cikiinigondangdia the end choose cikiini gt grab gt gambir already mah time mepet confused pager ijo out mana pas deket indomaret point
26,enak banget jogja parkir indomaret gratis ga kayak jakarta langsung tempatin sama tukang parkir ga jelas,really good joggernaut parking indomaret free ga kayak jakarta direct placein same parkers ga clear
27,aku laperr irr knapaa jg indomaret bukaa fakkk pondphuwin weare ep11,i laperr irr knapaa jg indomaret bukaa fakkk pondphuwin weare ep11
28,kenapaa indomaret bukaaa aku laperr irr suruh mam apaann iiniiii pondphuwin weare ep11,whya indomaret openaa i laperr irr tell mam what iiniiii pondphuwin weare ep11
29,paling murah periode 13 19 juiini 2024 mulai jajan hingga butuh kamu promosi paling murah pasti harga spesial laho cuss langsung indomaret dekat bela produk,cheapest period 13 19 juiini 2024 from snacks until you need the cheapest promotion for sure special prices laho cuss directly indomaret near defends the product
30,indomaret jawa 6,java Indomaret 6
31,up disiini link gacor baik,up here the link is good gacor
32,tida makan aku mau kampus jajan roti indomaret ajh,i don't want to eat. I want the indomaret ajh bread snack campus.
33,emg gendeng si nugas g order apa2 giini gjd beli brg indomaret aja mo kluarnya gen kek giini,emg gendeng si nugas g order apa2 giini gjd beli brg indomaret aja mo kluarnya gen cake giini
34,indomaret aja lebih enak,indomaret is better
35,terus apa jadi tembok beda ama zioiinis klo lu laku sama zioiinis jg laku,then what is the different wall ama zioiinis klo lu behavior same zioiinis also behavior
36,soal mau beli indomaret ga jadi trus bjir,about wanting to buy indomaret or not so trus bjir
37,kopi indomaret enak banget,indomaret coffee is really good
38,kira iini deket indomaret palmerah,i think it's close to Indomaret Palmerah
39,kalo tahu telor langgan depan indomaret candi mendut petis muantep pol,if you know eggs subscribe in front of indomaret temple mendut petis muantep pol
40,ngunyah eskrim indomaret bunderan depan malah gleyot2an ama siapa dong,ngunyah ice cream indomaret bunderan front even gleyot2an ama who dong
41,satset udah lama ga gambar sama udah ga asupan aamon bot lewat tl selain indomaret huhuhu rindu aamon bot ken fred sama vier ngejar ngejar aamon ssampai gila,satset for a long time no same picture already no intake of aamon bot through tl other than indomaret huhuhu miss aamon bot ken fred sama vier chase aamon ssampai gila
42,lebih sukaa kursi indomaret,indomaret chair preferred
43,iyah emang sengaja member keluar lagu baru setel ajh entar alfamart indomaret yogya punya ikut setel,iyah eang accidentally member out a new song setet ajh entar alfamart indomaret yogya have to follow setet
44,udah kak shen vit d c e terus minum ku air infused lemon timun buat sabun moist kok aku dulu pake gampg sama kering terus pindah sabun korea indomaret tu mending,already brother shen vit d c e continue to drink me water infused lemon cucumber for moist soap how come I used to use gampg same dry continue to move Korean soap indomaret mending
45,kayak langsung keinget cashew milk chocolatenya indomaret,kayak directly keinget cashew milk chocolatenya indomaret
46,manfaat sok asik sm mbamas indomaret,benefits of pretentious sm mbamas indomaret
47,iini sama aja paket ku kartu atm udah nomor email alamat lengkap bank bukan antar rumah malah antar gudang indomaret,this is the same as my package atm card already email number full address of the bank instead of between houses even between warehouses indomaret
48,jeonghan irabis badminton gor mekarsari nongkrong grandwis makan taichann balik tambun beli pointcoffee indomaret lut nongkrong gang depan rumah,jeonghan irabis badminton gor mekarsari hang out grandwis eat taichann back tambun buy pointcoffee indomaret lut hang out alley in front of the house
49,njir ngadem indomaret,njir ngadem indomaret
50,mau indomaret sbelum gkapan,want indomaret sbelum gkapan
51,bayar tiket bus onlen kena cas berapa min,pay for a bus ticket onlen be charged how many minutes
52,mungkin nyari rokok sampoerna mild nunggu dilobby indomaret,maybe search for a mild shampooerna cigarette wait in the indomaret lobby
53,indomaret,Indomaret
54,aku ga diet lebih padahal aku cuma cut gula karbo kompleks aja sama emang ga nafsu makan aja sih efek bikin kliyengan nyaris pengsan tadi aku pulang dah jajan es krim indomaret self reward,"i don't diet more even though I just cut complex carbo sugar, just the same, I don't have an appetite, the effect of making kliyengan was almost faint just now I went home and snacked on indomaret self-reward ice cream"
55,apa indomaret tengah malem,what is indomaret in the middle of malem
56,pagi sih indomaret beli makan packing hdhhh,in the morning indomaret buy food packing hdhhh
57,penasaran tadi cimory yak 2130 keluar indomaret 2132 nysampai kosan ketika lupa ingat,curious just now cimory yak 2130 out indomaret 2132 nysai kosan when forget to remember
58,pernah indomaret mau izi flaz malah bilang mas flash sale wkwkkwwkwkw tawar diri flash sale,ever indomaret want izi flaz instead say mas flash sale wkwkkwwkwkw offer yourself flash sale
59,indomaret,Indomaret
60,indomaret rumah ke2 kek,indomaret 2nd house cake
61,tadi indomaret nemu parfum sama persis kayak langsung w semprotin badan biar nyium bau bcs kangen banget rit,just now indomaret found the exact same perfume like directly w sprayin the body so that you smell the smell of bcs kangen really rit
62,mending bebas laktosa plain after tastenya maiinis2 nya mana indomaret promo 7k jadi 4k cuma gt langka,mending lactose-free plain after tastenya maiinis2nya mana indomaret promo 7k so 4k only gt rare
63,mau beli pempes sama suami mama ku indomaret komplek tutup huft,want to buy a pension with my mother's husband indomaret complex closed huft
64,lu cek dompet isi cuma bon indomaret rit pondphuwin weare ep11,lu check wallet contents only bon indomaret rit pondphuwin weare ep11
65,gimana iinih tanggap min korban gak aku anak aku loh jadi iini gak sekali iini aja udah sering basmi tukang parkir liat resah banget rugi orang ssampai males mau bela tuh gara kang parkir,how do iinih respond to min victims or not I'm a child I know so iini not once iini already often eradicate parking lot drivers clay fret really lose people ssampai males want to defend tuh gara kang parking
66,iini benhil depan gudeg pejompongan samping indomaret point,iini benhil depan gudeg pejompongan beside indomaret point
67,kangen kopi yummy indomaret,kangen coffee yummy indomaret
68,jatuh injak sama tukang parkir tukang parkir ssampai 3 orang semua jahat kek preman terus tulis parkir gratis suka diumpetin min tadi kerja indomaret nya ssampai takut bilang gak beraiini soal preman indomaret disiini jadi sepi min,fall on foot with the parking lot parking lot up to 3 people all bad cake thugs keep writing free parking likes to be encapsulated min earlier his indomaret work ssampai afraid to say no to this about thugs indomaret here so it's lonely min
69,beli skincarenya ga dokter gitu to skincarenya beli2 gitu indomaret indomaret emang boj cosrx sama skim1004 apa,buy skincarenya ga doctor gitu to skincarenya beli2 gitu indomaret indomaret emang boj cosrx sama skim1004 apa
70,nyarinya alfa apa indomaret kak,look for alpha what is indomaret sis
71,palmerah giinian serba 10 posisi sebrang jakartapost belah gang indomaret kalo pagi jam tengah 6 pagi udah jual jam 7an udah habis,palmerah giinian all 10 positions across the jakartapost part of the indomaret alley if the morning at midnight 6 am has sold out at 7am
72,mba mba indomaret hapal mau beli apa jadi lucu deh,mba mba indomaret memorize what you want to buy it so funny
73,udah makanya markir aja indomaret lbh gede gaji pungli daripd korporat njeng,that's why marker just indomaret lbh big pungli salary from njeng corporate
74,ihhh sama aku jajah alfa indomaret tapi ngga,ihhh same I colonize alfa indomaret but not
75,ubek tas kaga nemu dimsum ir lah mayan berapa belas 2 biji maaf mba kasir indomaret stasiun grogol ga ikhlas biar berapa belas doang jg mana ga kasih struk jg tiap beli kesitu,ubek bag kaga nemu dimsum ir lah mayan how many twelve 2 seeds sorry mba cashier indomaret grogol station ga ikhlas so how many twelve doang jg mana ga kasih struk jg each buy it there
76,tadi balik kerja beli nasi sama dimsum indomaret stasiun grogol nysampai rumah langsung rebah udah aja ga ngecek tas eh pas buka tas baru nyadar ir kasih tadi nasi doang dimsumnya kaga sehat sehat dah lu mba kasir,just now went back to work buying rice with dimsum indomaret grogol station nysai house immediately collapsed ja ga ngeckek bag eh pas open a new bag nyadar ir kasih tadi nasi doang dimsumnya kaga sehat sehat dah lu mba cashier
77,res balik res tinggal kantong indomaret,resalik res live indomaret pouch
78,besok libur enak jalal hmzzz indomaret,tomorrow is a good holiday jalal hmzzz indomaret
79,iini mah seventeen jajan indomaret bjil,iini mah seventeen indomaret snacks bjil
80,bodo beli kopi indomaret point aja blee blee,bodo buy coffee indomaret point just blee blee
81,abis indomaret my hand was really full cari uang tas gada dompet saking clumsayanya hapeku jatuh ing kasir judging me mbatin paling walaah mba mba mah ngopo isin tenan,abis indomaret my hand was really full find money bag mace wallet so clumsy hapeku fall ing cashier judging me mbatin most walaah mba mba mah ngopo isin tenan
82,tebak indomaret mana klo gede diparkirin,guess which indomaret klo gede is parked in
83,too muchh mending naik buaya sih balik indomaret langsung gas jajah duiinia air,too muchh mending crocodile ride back indomaret directly gas jajah duiinia water
84,mba mba indomaret iini,mBA MBA Indomaret Iini
85,lebih suka indomaret nyata,prefer real indomaret
86,jinguk langsung otw indomaret tuku henbodi,jinguk direct otw indomaret tuku henbodi
87,gabut akhir jalan indomaret beli kopi sama sari roti,end of indomaret road buy coffee with cider
88,otw temeiinin indomaret fresh biasa,otw temeiinin indomaret fresh regular
89,scoups vernon wonu lg jajan indomaret uiinit iini mah,scoups vernon wonu lg snacks indomaret uiinit iini mah
90,selamat datang indomaret pondphuwin weare ep11,welcome indomaret pondphuwin weare ep11
91,selamat datang indomaret,welcome indomaret
92,abis beli sushi depan indomaret rasa sama harga cocok buat tengah bulan sekarat iini,abis buy sushi in front of indomaret feel the same price is suitable for the middle of this dying month
93,pernah gak kurang duit pas bayar indomaret,never less money to pay indomaret
94,ah kak meang online yah indomaret kak kurleb23k,ah sis meang online yah indomaret kak kurleb23k
95,beli oiinigiri indomaret point aja kalo itumah,buy oiinigiri indomaret point only if it's a house
96,kripik ubi indomaret 710 enak but gk sesuai ekspektasi sayatt,indomaret sweet potato chips 710 delicious gk boots according to my expectations
97,sedang tahan diri nang depan indomaret,being restrained in front of indomaret
98,pk 7 dekat indomaret nder antar jg,pk 7 near indomaret nder between jg
99,kewpie wijen sangrai diskon indomaret,kewpie sesame roast indomaret discount
100,aku udah iyain dedek duiinia udah sabda dedek wajib sapa aku pagi siang sore kayak indomaret hayo dedek,"i am already yes, duiinia grandpa has said that grandpa must greet me in the morning and afternoon like indomaret hayo grandpa"
101,bersayaukur banget indomaret fresh,thanks very much indomaret fresh
102,ir esport nya lut aula pake proyektor reflek retri indomaret,ir esportnya lut hall use projector reflex retri indomaret
103,indomaret ngide banget ganti sosis keju balikin ga lama,indomaret really wants to replace sausage cheese balikin ga lama
104,hasil buru ultramilk lt3 punya in felix amp changbin 3 jadi mauuu trade wtt want to trade want bangchan leeknow han seungmin have in felix changbin wtt straykids stray kids skz ultramilk ultra milk indomaret pc,ultramilk lt3 hunt results have in felix amp changbin 3 so mauuu trade wtt want to trade want bangchan leeknow han seungmin have in felix changbin wtt straykids stray kids skz ultramilk ultra milk indomaret pc
105,emg si cowok sangean sumpah cewek kok mau aja gitu loh gggg ajak ngecas kosan cowok dah gitu jam 3 pagi brooooo atur mah cari indomaret dekat cafe dekat buat ngecas hp,emg the guy sangean swear girl how would you like that loh gggg invite ngecas kosan boy already at 3 am brooooo arrange mah find indomaret near cafe near for ngecas phone
106,tbh i like to change his contact name haha kayak nappeunnom lampu indomaret kardus pepsodent beruang kutub lagi sesuai moodku gapeduli nama gtc anehaneh i dont care hahahaha,tbh i like to change his contact name haha like nappeunnom lamp indomaret cardboard pepsodent polar bear again according to my mood gapeduli name gtc anehaneh i dont care hahahaha
107,kalau badan mungil mesti praktek pakai sapu indomaret warna kuiining biru,"if you have a petite body, you must practice using an indomaret broom in blue quiining color"
108,baru tau kalo indomaret produksi sari buah nanas markisa enak banget,just found out that indomaret pineapple juice production is very tasty
109,iini seventeen ken sudut indomaret sama alfamakah,iini seventeen ken indomaret angle sama alfamakah
110,iya betul sempat beli tahu sepang samping taman literasi rombong kulak masakancemilan harga jangkau beli makanminum circle k indomaret situ harga ikut standar indonesia,yes really had time to buy tofu next to the literacy park rombong culak culinary snacks prices range buy food drink circle k indomaret there prices follow Indonesian standards
111,ih jengkel banget indomaret deket rumah kapan pc nya,ih annoyed indomet really near the house when the pc
112,iini kalo mau beli kartu etoll sekarang mana kok indomaret alfamart udah ga jual hadeh,iini if you want to buy an etoll card now where is indomaret alfamart already not selling hadeh
113,sangking bloon nya mau beli jajan indomaret jual apa ma,sangking bloon nya mau beli jajan indomaret jual apa ma
114,apotek indomaret kakk,indomaret kakk pharmacy
115,wong neng indomaret mbayare karo kartu jan nyueiinii tenann,wong neng indomaret mbayare karo card jan nyueiinii tenann
116,candu sosis indomaret alias boncos banget,indomaret sausage opium aka boncos really
117,aku lulus utebak aku bakal joget indomaret,i graduated utebak I will dance indomaret
118,voucher bela indomaret diskon promo lazada payday sale gaji sale 66 sale,voucher defend indomaret discount promo lazada payday sale salary sale 66 sale
119,gt man indomaret,gt man indomaret
120,indomaret voucher bela digital rp 25000 diskon promo lazada payday sale gaji sale harbolnas 66 sale,indomaret digital martial voucher rp 25000 discount promo lazada payday sale salary sale harbolnas 66 sale
121,dapet coklat cowok kata papa pulang indomaret,get brown boy said papa went home indomaret
122,basement hall 56 indomaret situ adem sh,basement hall 56 indomaret situ adem sh
123,ngiyup teras indomaret nyruput kopi rokok signature,ngiyup terrace indomaret nyruput coffee cigarette signature
124,ive been a victim too and im so sorry that this happened to u but u kinda dumb on this kek lu kasih liat kontol depan muka pubelik lu mau ngikut kosnya what dya expect kinderjoy piring indomaret nahh girl u shud know better,ive been a victim too and im so sorry that this happened to u but u kinda dumb on this cake you love stick dick in front of pubelik face you want to follow the cost what dya expect kinderjoy indomaret plate nahh girl u shud know better
125,trus gimana iya henti indomaret pura beli minum dah berapa kali tuh 5 kali mungkin wkwkw lama jogging situ,trus how do you stop indomaret temple buy a drink already how many times 5 times maybe wkwkw long jogging there
126,jeonghan sihh elitan dikit grandwis tambun kalo beli kopi indomaret point trus kalo nongkrong sopel nenek babeh bareng,jeonghan sihh elitan little grandwis tambun if you buy coffee indomaret point trus if you hang out with your grandma babeh
127,indomaret tuh bang,indomaret tuh bang
128,somay bang udin jembatan 2 narogong belakang indomaret,somay bang udin bridge 2 narogong rear indomaret
129,emg indomaret tempat nongkrong baik,emg indomaret good hangout spot
130,yuk hujan henti yuk mau indomaret ajaaa bentar iini mau turun mobil basah2 turun nya jd basah plissss henti dl mo jajan,let's stop the rain let's go to indomaret ajaaa bentar iini want to get off the wet car2 get off the wet jd plissss stop dl mo snacks
131,indomaretalfamart ka,indomaretalfamart ka
132,iini orang malah diem aje bukannye spill tempatnye 2 tempat aku tau 1 benhil depan rs mintohardjo 2 palmerah iini susah jelasinnya di belah indomaret deket sama gedung kompas,here people even diem aje notnye spill placenye 2 place I know 1 benhil in front of rs mintohardjo 2 palmerah this is difficult to clear in the indomaret near the same compass building
133,gilir iiniat indomaret malah ujan,queue iiniat indomaret even ujan
134,alas sekarang lari bisiinis tambang udah sepi order jagain tempat ibadah bubarin aji satapiam acara dangdut mau lirik jagain parkir indomaret udah kalah sama akamsi,alas now run busiinis mine is deserted order jagain place of worship bubarin aji satapiam dangdut event want lyrics jagain parking indomaret already lost akamsi same
135,sungkem sek ambek mbak2 indomaret e,sungkem sek ambek mbak2 indomaret e
136,pinang kasir indomaret,indomaret cashier nut
137,indomaret gampang jadi beli,indomaret is easy to buy
138,hasil bela 24 free 8 susu indomaret klik wtt felix jeongin to bangchan leeknow han sungmin,results 24 free 8 indomaret milk click wtt felix jeongin to bangchan leeknow han sungmin
139,entry level tu parfum fres 15rban beli indomaret,entry level perfume fres 15rban buy indomaret
140,ihhh gak struck indomaret trs iini kayak harga jd beda gt,ihhh not struck indomaret trs iini like the price jd different gt
141,tumben banget keti kamu irit angsulan indomaret,very tumben keti kamu irit angsulan indomaret
142,orang gila mana orang gila mana orang gila stress dikit jajan stress jajan nang sekarang aku jajan mixue chiki balls cokelat sosis indomaret apa diet,crazy people where crazy people where crazy people stress little snacks stress snacks nang now I snack mixue chiki balls chocolate sausage indomaret what diet
143,indomaret musim salju ga jo,indomaret winter ga jo
144,kak wkwkwk aja ide love shot tari laris indomaret,sis wkwkwk just the idea of love shot dance bestselling indomaret
145,disiini aku beli indomaret apa alfa yh lupak,here I buy indomaret what is alpha yh lupak
146,yuk seng kt indomaret poca date,yuk seng kt indomaret poca date
147,kurban berkah baznas 2024 makin mudah lalu indomaret,the 2024 baznas blessing sacrifice is easier then indomaret
148,boleeh sayang kamu indomaret aku alfamart yaa kan damping gak pisah,boleeh love you indomaret I'm alfamart right damping inseparable
149,biasa indomaret naik jet,regular indomaret jet ride
150,gprrcaya lg sm diskon indomaret bjir aku beli cimori harga diskon pas nysampai kasir gd bjir lah,gprrcaya lg sm discount indomaret bjir I bought cimori discount price when I arrived at the cashier gd bjir lah
151,suka banget kacang jumbo nya,i really like the jumbo beans
152,mau dibikiinin indomaret sekali bleh,want to be dibikiinin indomaret once bleh
153,indomaret 40rb nder lupa brp gram pokok kotak gitu,indomaret 40rb nder forgot brp gram tree box like that
154,sekarang sobat tarik tunai kartu via mobile banking application lebih mudah indomaret loh transaksi tarik tunai kartu indomaret dapat produk tebus murah chiki snack balls wagyu beef wagyu 55g rp 3500 periode 130 juiini 2024,now my friend withdraws the card via mobile banking application easier indomaret loh transaction withdraw cash indomaret card can redeem products cheap chiki snack balls wagyu beef wagyu 55g rp 3500 period 130 juiini 2024
155,coba deh aku enggak aku beneran sensitif soal padahal murah bangetaku shock indomaret,try it I'm not I'm really sensitive about it even though it's so cheap I'm shocked indomaret
156,pegawai indomaret,indomaret employees
157,tmpt ku baru ad d bbrp indomaret tentu,tmpt ku baru ad d bbrp indomaret pasti
158,sumpah ing banget ak kan indomaret dpan komplek baju ada ga make up bner polos rambut ikal ak sdkit beranta trs pas indomaret ps mw byar kasir dtg 2 cewe kynya msh smp liatin ak atas smpe bwah bilang giini sedih deh liat wtf,i swear I really want to be indomaret dpan clothes complex there is no make up bner plain curly hair ak sdkit beranta trs pas indomaret ps mw byar cashier dtg 2 cewe kynya msh smp liatin ak over smpe bwah say giini sad deh liat wtf
159,up disiini tempat gacor baik,up here the gacor place is good
160,anggota patroli gerak aktif indomaret pantau situasi kurang potensi tindak kriminalitas selasa 1162024 patroli indomaret laku tuju meiiningkatkan aman unjung karyawan toko,members of the indomaret active motion patrol monitor the situation less potential for criminal acts Tuesday 1162024 indomaret patrols behavior towards meiiningkatkan aman unjung shop employees
