,full_text,tweet_english
161,siini masuk indomaret dingin,siini enter indomaret cold
162,apk paling ga klik indomaret gilaa mau tanya2 helpdesk nomernya daftar gaada tombol pesan batal iini waktu posisi pesan proses nyusahin guna baru banget,apk least click indomaret crazya want to ask questions helpdesk number list gaada button message cancel this is when the position of the message process nyusahin for new really
163,duga lengkap izin bangun indomaret tetap jalan,complete suspicion of indomaret construction permit remains
164,oiinigiri indomaret tuna mayo 2 sama yoghurt cimory squeeze rasa peach 2 bakso kenzler 5 wkwkwkwk,oiinigiri indomaret tuna mayo 2 sama yoghurt cimory squeeze rasa peach 2 bakso kenzler 5 wkwkwkwk
165,ayoo lindung indomaret,ayoo lindung indomaret
166,halo tadi mes bela klik indomaret baru ingat nomer whatsapp sudah ganti khawatir kurir hubung bantu,hello earlier mes defend click indomaret just remember whatsapp number has changed worry courier contact help
167,kok pulang kerja ngerokok depan indomaret mending nyoto wkwkwk,why come home from work smoking in front of indomaret mending nyoto wkwkwk
168,purnama bebek indomaret atm,full moon duck indomaret atm
169,mending nang acakacak indomaret depan gang,mending nang random indomaret front alley
170,menorehhh dpt indomaret kalo taman kanan jalan,tapping dpt indomaret if the park is right of way
171,jembatan 2 belakang indomaret,bridge 2 behind Indomaret
172,kak kok ku gk udah 3 indomaret 1 alfamart kasir bingung saia,sis how come I gk already 3 indomaret 1 alfamart cashier confused saia
173,kak kok ku gk udah 3 indomaret 1 alfamart kaya kasir nya skill issues mungkin takut pernah,sis how come I gk already 3 indomaret 1 alfamart kaya kasir nya skill issues may be afraid ever
174,ngga makna buat ngga simpang aku cuma bingung kamu ngga circle k aja buat charger hp karna kayak alfamart indomaret bal udah jarang 24 jam tahu aku circle k buka 24 jam kali ajar waspada,no meaning for not intersecting I'm just confused you don't circle k just for cellphone chargers because like alfamart indomaret bal it's rarely 24 hours know I circle k open 24 hours teach alert
175,kak kok ku gk udah 3 indomaret 1 alfamart kaya kasir nya skill issues mungkin takut pernah,sis how come I gk already 3 indomaret 1 alfamart kaya kasir nya skill issues may be afraid ever
176,kak kok ku gk udah 3 indomaret 1 alfamart kaya kasir nya skill issues mungkin takut pernah,sis how come I gk already 3 indomaret 1 alfamart kaya kasir nya skill issues may be afraid ever
177,moga kemas muka bong biar kalo indomaret aku bsa pamer mama ak,let's tidy up the bong face so that if indomaret I can show off mama ak
178,siap neng ngiuhan dulu indomaret ujan iining,ready to neng ngiuhan first indomaret ujan iining
179,iya mana tomat indomaret point udah mahal lg tomat seger situ doang,yes where are indomaret point tomatoes already expensive lg tomatoes sync there doang
180,emang orang tidur indomaret,people sleep indomaret
181,jangan nang indomaret,don't nang indomaret
182,wkwkwk km jadi ba tiap hari sgmu indomaret point,wkwkwk km so ba every day sgmu indomaret point
183,golek neng indomaretwkkkk,golek neng indomaretwkkk
184,bener a konon kata gerry marsden waktu nulis lagu tuh pas iinikmatin peuyeum depan indomaret cicaheum,bener a said gerry marsden kali nulis lagu tuh pas iinikmatin peuyeum depan indomaret cicaheum
185,ngintip kasir indomaret mulus,ngintip kasir indomaret seamless
186,hiburane wong lanang mung kursi wesi indomaret,entertainmente wong lanang mung chair wesi indomaret
187,dar pik 2 aja habis 100k tiga cuma 3 titik pulau lalu nongkrong indomaret poin ayo lebih muter2,from pik 2 just finished 100k three only 3 points of the island then hang out indomaret points let's go more muter2
188,alfamart sama indomaret jauh rumah sayang mana nyebrang rel kereta aduh mungkin besok beli soal depan sekolah alfamart jalan dikit infomaret fresh labas ketemu superindo sama chamart,alfamart with indomaret far from home dear where cross the train rail ouch maybe tomorrow buy about the front of the school alfamart road little infomaret fresh labas meet superindo with chamart
189,polsek ranuyoso kuat aman patroli indomaret lumajangdalam upaya cegah gangsayan aman tertib masayaarakat kamtibmas polsek ranuyoso intensif patroli miini market indomaret,polsek ranuyoso kuat aman patrol indomaret lumajangd in an effort to prevent gangsayan aman orderly community kamtibmas polsek ranuyoso intensified patrol miini market indomaret
190,rabu madness is real ing miinimal beli indomaret point ga sih hari iini,wednesday madness is real ing miinimal buy indomaret point ga anyway today
191,bm iini banget dil martabak tapi selalu ga dapet indomaret alfa siini,bm iini really dil martabak but always can't get indomaret alfa siini
192,iya kak kyknya memang jrg konter cara down app by u aja dulu trs ad pilih beli kartu kuota gt 7gb hrgnya 25 rb buat beli pertama isi kuota aja 15rb terus pilih no sendiri 4 digit lalu bayar pick up indomaret,yes brother kyknya indeed jrg counter how to down app by u aja first trs ad choose to buy a quota card gt 7gb hrgnya 25 rb to buy first fill quota aja 15rb continue to choose your own number 4 digits and then pay pick up indomaret
193,seringkali doi post gera beli warung tetangga papas terus indomaret wkkwk,often doi post gera buy neighboring papas stalls and indomaret wkkwk
194,pecel harga 30 lbh murah bu budi belah barat indomaretjangan lupa belah pecel ayam mayashi,"pecel price 30 lbh cheap, ma'am western part indomaret, don't forget to split the mayashi chicken pecel"
195,withdraw indomaret sama alfa,withdraw indomaret sama alpha
196,belah kiri yomart kalau kanan yomart kan indomaret,the left side of the yomart if the right side of the yomart is indomaret
197,indomaret mana aku jajah cari cimory chocolate mint,MYMEMORY WARNING: YOU USED ALL AVAILABLE FREE TRANSLATIONS FOR TODAY. NEXT AVAILABLE IN  03 HOURS 47 MINUTES 34 SECONDS VISIT HTTPS://MYMEMORY.TRANSLATED.NET/DOC/USAGELIMITS.PHP TO TRANSLATE MORE
198,ngemper nungguim hujan reda krn keburu tap keluar alfa indomaret penuh tempat duduk dingin lama2 siini,MYMEMORY WARNING: YOU USED ALL AVAILABLE FREE TRANSLATIONS FOR TODAY. NEXT AVAILABLE IN  03 HOURS 47 MINUTES 33 SECONDS VISIT HTTPS://MYMEMORY.TRANSLATED.NET/DOC/USAGELIMITS.PHP TO TRANSLATE MORE
199,pdhl bs modif kaos kaki indomaret p,MYMEMORY WARNING: YOU USED ALL AVAILABLE FREE TRANSLATIONS FOR TODAY. NEXT AVAILABLE IN  03 HOURS 47 MINUTES 32 SECONDS VISIT HTTPS://MYMEMORY.TRANSLATED.NET/DOC/USAGELIMITS.PHP TO TRANSLATE MORE
200,duwit baru bayi bensin rumah sakit indomaret,MYMEMORY WARNING: YOU USED ALL AVAILABLE FREE TRANSLATIONS FOR TODAY. NEXT AVAILABLE IN  03 HOURS 47 MINUTES 31 SECONDS VISIT HTTPS://MYMEMORY.TRANSLATED.NET/DOC/USAGELIMITS.PHP TO TRANSLATE MORE
201,mama ku beli mie indomaret kerang nya bawa pulang woi,MYMEMORY WARNING: YOU USED ALL AVAILABLE FREE TRANSLATIONS FOR TODAY. NEXT AVAILABLE IN  03 HOURS 47 MINUTES 31 SECONDS VISIT HTTPS://MYMEMORY.TRANSLATED.NET/DOC/USAGELIMITS.PHP TO TRANSLATE MORE
202,ken jalan sendiri aja indomaret malesss ken beli mogumogu sama chitato buat nonton ajakin sama kakak ku pas sekali masjid,MYMEMORY WARNING: YOU USED ALL AVAILABLE FREE TRANSLATIONS FOR TODAY. NEXT AVAILABLE IN  03 HOURS 47 MINUTES 30 SECONDS VISIT HTTPS://MYMEMORY.TRANSLATED.NET/DOC/USAGELIMITS.PHP TO TRANSLATE MORE
203,indomaret samping janari bs tom,MYMEMORY WARNING: YOU USED ALL AVAILABLE FREE TRANSLATIONS FOR TODAY. NEXT AVAILABLE IN  03 HOURS 47 MINUTES 29 SECONDS VISIT HTTPS://MYMEMORY.TRANSLATED.NET/DOC/USAGELIMITS.PHP TO TRANSLATE MORE
204,coba kalo karyawan alfa indomaret habis tu rampok,MYMEMORY WARNING: YOU USED ALL AVAILABLE FREE TRANSLATIONS FOR TODAY. NEXT AVAILABLE IN  03 HOURS 47 MINUTES 28 SECONDS VISIT HTTPS://MYMEMORY.TRANSLATED.NET/DOC/USAGELIMITS.PHP TO TRANSLATE MORE
205,ntah tehh aku ge ssampai setoples ku kumpulin kembalin indomaret kadang ku pake pas bela indomaret,MYMEMORY WARNING: YOU USED ALL AVAILABLE FREE TRANSLATIONS FOR TODAY. NEXT AVAILABLE IN  03 HOURS 47 MINUTES 28 SECONDS VISIT HTTPS://MYMEMORY.TRANSLATED.NET/DOC/USAGELIMITS.PHP TO TRANSLATE MORE
206,radi pagi ngetweet bakal daboy indomaret,MYMEMORY WARNING: YOU USED ALL AVAILABLE FREE TRANSLATIONS FOR TODAY. NEXT AVAILABLE IN  03 HOURS 47 MINUTES 27 SECONDS VISIT HTTPS://MYMEMORY.TRANSLATED.NET/DOC/USAGELIMITS.PHP TO TRANSLATE MORE
207,geli kali g ingat bencong ddk indomaret batoh sekarang udah jadi food vlogger tiktok,MYMEMORY WARNING: YOU USED ALL AVAILABLE FREE TRANSLATIONS FOR TODAY. NEXT AVAILABLE IN  03 HOURS 47 MINUTES 26 SECONDS VISIT HTTPS://MYMEMORY.TRANSLATED.NET/DOC/USAGELIMITS.PHP TO TRANSLATE MORE
208,sdhh duga kata sayae mending pindah indomaret teraang,MYMEMORY WARNING: YOU USED ALL AVAILABLE FREE TRANSLATIONS FOR TODAY. NEXT AVAILABLE IN  03 HOURS 47 MINUTES 25 SECONDS VISIT HTTPS://MYMEMORY.TRANSLATED.NET/DOC/USAGELIMITS.PHP TO TRANSLATE MORE
209,indomarc iinih apaansi tau cuma indomaret,MYMEMORY WARNING: YOU USED ALL AVAILABLE FREE TRANSLATIONS FOR TODAY. NEXT AVAILABLE IN  03 HOURS 47 MINUTES 25 SECONDS VISIT HTTPS://MYMEMORY.TRANSLATED.NET/DOC/USAGELIMITS.PHP TO TRANSLATE MORE
210,masayaa allah hujan kemarin erti banget sma aku kemarin aku indomaret pas indomaret grimis pas aku nysampai rumah baru deras trs aku nunggu ujan mau rs jalan ga ujan pas aku nysampai rs eh baru ujan,MYMEMORY WARNING: YOU USED ALL AVAILABLE FREE TRANSLATIONS FOR TODAY. NEXT AVAILABLE IN  03 HOURS 47 MINUTES 24 SECONDS VISIT HTTPS://MYMEMORY.TRANSLATED.NET/DOC/USAGELIMITS.PHP TO TRANSLATE MORE
211,oiya gen z tahun iini masuk usia batas maksimal akwoakwaik selamat datang indomaret,MYMEMORY WARNING: YOU USED ALL AVAILABLE FREE TRANSLATIONS FOR TODAY. NEXT AVAILABLE IN  03 HOURS 47 MINUTES 23 SECONDS VISIT HTTPS://MYMEMORY.TRANSLATED.NET/DOC/USAGELIMITS.PHP TO TRANSLATE MORE
212,bjrotttttt pegawai indomaret mereun ah,MYMEMORY WARNING: YOU USED ALL AVAILABLE FREE TRANSLATIONS FOR TODAY. NEXT AVAILABLE IN  03 HOURS 47 MINUTES 22 SECONDS VISIT HTTPS://MYMEMORY.TRANSLATED.NET/DOC/USAGELIMITS.PHP TO TRANSLATE MORE
213,indomaret seng,MYMEMORY WARNING: YOU USED ALL AVAILABLE FREE TRANSLATIONS FOR TODAY. NEXT AVAILABLE IN  03 HOURS 47 MINUTES 22 SECONDS VISIT HTTPS://MYMEMORY.TRANSLATED.NET/DOC/USAGELIMITS.PHP TO TRANSLATE MORE
214,bela produk kategori makan amp minum mana iinih sobat promo hemat iinih indomaret info lengkap,MYMEMORY WARNING: YOU USED ALL AVAILABLE FREE TRANSLATIONS FOR TODAY. NEXT AVAILABLE IN  03 HOURS 47 MINUTES 21 SECONDS VISIT HTTPS://MYMEMORY.TRANSLATED.NET/DOC/USAGELIMITS.PHP TO TRANSLATE MORE
215,umume wong kalah paling banter lungguh ngarep indomaret karo nenggak golda coffee,MYMEMORY WARNING: YOU USED ALL AVAILABLE FREE TRANSLATIONS FOR TODAY. NEXT AVAILABLE IN  03 HOURS 47 MINUTES 20 SECONDS VISIT HTTPS://MYMEMORY.TRANSLATED.NET/DOC/USAGELIMITS.PHP TO TRANSLATE MORE
216,biawak tadi pagi akhir keluar rumah trs nyebrang indomaret wkwkwk apa mungkin laper,MYMEMORY WARNING: YOU USED ALL AVAILABLE FREE TRANSLATIONS FOR TODAY. NEXT AVAILABLE IN  03 HOURS 47 MINUTES 19 SECONDS VISIT HTTPS://MYMEMORY.TRANSLATED.NET/DOC/USAGELIMITS.PHP TO TRANSLATE MORE
217,push up indomaret aja kalau malu alfa v,MYMEMORY WARNING: YOU USED ALL AVAILABLE FREE TRANSLATIONS FOR TODAY. NEXT AVAILABLE IN  03 HOURS 47 MINUTES 18 SECONDS VISIT HTTPS://MYMEMORY.TRANSLATED.NET/DOC/USAGELIMITS.PHP TO TRANSLATE MORE
218,min varian semua indomaret sihhh,MYMEMORY WARNING: YOU USED ALL AVAILABLE FREE TRANSLATIONS FOR TODAY. NEXT AVAILABLE IN  03 HOURS 47 MINUTES 18 SECONDS VISIT HTTPS://MYMEMORY.TRANSLATED.NET/DOC/USAGELIMITS.PHP TO TRANSLATE MORE
219,indomaret isi seventeen brrahhhh,MYMEMORY WARNING: YOU USED ALL AVAILABLE FREE TRANSLATIONS FOR TODAY. NEXT AVAILABLE IN  03 HOURS 47 MINUTES 17 SECONDS VISIT HTTPS://MYMEMORY.TRANSLATED.NET/DOC/USAGELIMITS.PHP TO TRANSLATE MORE
220,tanggal bayar lihat mjkn pandawa 0811 8750 400 care center 165 bayar pertama kali laku manual lebih lalu mbanking atm bank kantor pos gadai alfamart indomaret loketloket ppob linkaja tks joy 22,MYMEMORY WARNING: YOU USED ALL AVAILABLE FREE TRANSLATIONS FOR TODAY. NEXT AVAILABLE IN  03 HOURS 47 MINUTES 16 SECONDS VISIT HTTPS://MYMEMORY.TRANSLATED.NET/DOC/USAGELIMITS.PHP TO TRANSLATE MORE
221,pake mi telur bulet lebih gede biasa bunder gtu pasar nah beli lebih kecil indomaret adaa,MYMEMORY WARNING: YOU USED ALL AVAILABLE FREE TRANSLATIONS FOR TODAY. NEXT AVAILABLE IN  03 HOURS 47 MINUTES 15 SECONDS VISIT HTTPS://MYMEMORY.TRANSLATED.NET/DOC/USAGELIMITS.PHP TO TRANSLATE MORE
222,dompet ku tebal kok vei isi struk indomaret,MYMEMORY WARNING: YOU USED ALL AVAILABLE FREE TRANSLATIONS FOR TODAY. NEXT AVAILABLE IN  03 HOURS 47 MINUTES 15 SECONDS VISIT HTTPS://MYMEMORY.TRANSLATED.NET/DOC/USAGELIMITS.PHP TO TRANSLATE MORE
223,ken beli donat anget2 depan indomaret deh,MYMEMORY WARNING: YOU USED ALL AVAILABLE FREE TRANSLATIONS FOR TODAY. NEXT AVAILABLE IN  03 HOURS 47 MINUTES 14 SECONDS VISIT HTTPS://MYMEMORY.TRANSLATED.NET/DOC/USAGELIMITS.PHP TO TRANSLATE MORE
224,serius ga enak kemaren udah sempet beli indomaret pas mau bayar gak scan gak tau alahasil cancel beli,MYMEMORY WARNING: YOU USED ALL AVAILABLE FREE TRANSLATIONS FOR TODAY. NEXT AVAILABLE IN  03 HOURS 47 MINUTES 13 SECONDS VISIT HTTPS://MYMEMORY.TRANSLATED.NET/DOC/USAGELIMITS.PHP TO TRANSLATE MORE
225,aku umur segiini pas lihat polly pocket indomaret ken beli,MYMEMORY WARNING: YOU USED ALL AVAILABLE FREE TRANSLATIONS FOR TODAY. NEXT AVAILABLE IN  03 HOURS 47 MINUTES 12 SECONDS VISIT HTTPS://MYMEMORY.TRANSLATED.NET/DOC/USAGELIMITS.PHP TO TRANSLATE MORE
226,bang ajarin cara withdraw hamster combat dana gopay bca indomaret alfamart foto edit woiiii ga gitu konsep withdraw pas listing terus kapan ga tau lah si suka2nya dev,MYMEMORY WARNING: YOU USED ALL AVAILABLE FREE TRANSLATIONS FOR TODAY. NEXT AVAILABLE IN  03 HOURS 47 MINUTES 12 SECONDS VISIT HTTPS://MYMEMORY.TRANSLATED.NET/DOC/USAGELIMITS.PHP TO TRANSLATE MORE
227,doy coba bagi2 alfa indomaret jg dong,MYMEMORY WARNING: YOU USED ALL AVAILABLE FREE TRANSLATIONS FOR TODAY. NEXT AVAILABLE IN  03 HOURS 47 MINUTES 11 SECONDS VISIT HTTPS://MYMEMORY.TRANSLATED.NET/DOC/USAGELIMITS.PHP TO TRANSLATE MORE
228,guys kalau topup spay indomaret sekarang adminnya berapa deh,MYMEMORY WARNING: YOU USED ALL AVAILABLE FREE TRANSLATIONS FOR TODAY. NEXT AVAILABLE IN  03 HOURS 47 MINUTES 10 SECONDS VISIT HTTPS://MYMEMORY.TRANSLATED.NET/DOC/USAGELIMITS.PHP TO TRANSLATE MORE
229,deket indomaret pahlawan,MYMEMORY WARNING: YOU USED ALL AVAILABLE FREE TRANSLATIONS FOR TODAY. NEXT AVAILABLE IN  03 HOURS 47 MINUTES 09 SECONDS VISIT HTTPS://MYMEMORY.TRANSLATED.NET/DOC/USAGELIMITS.PHP TO TRANSLATE MORE
230,indomaret sayaarat tentu berlakuu,MYMEMORY WARNING: YOU USED ALL AVAILABLE FREE TRANSLATIONS FOR TODAY. NEXT AVAILABLE IN  03 HOURS 47 MINUTES 09 SECONDS VISIT HTTPS://MYMEMORY.TRANSLATED.NET/DOC/USAGELIMITS.PHP TO TRANSLATE MORE
231,indomaret sayaarat tentu berlakuu,MYMEMORY WARNING: YOU USED ALL AVAILABLE FREE TRANSLATIONS FOR TODAY. NEXT AVAILABLE IN  03 HOURS 47 MINUTES 08 SECONDS VISIT HTTPS://MYMEMORY.TRANSLATED.NET/DOC/USAGELIMITS.PHP TO TRANSLATE MORE
232,hhaa keinget anak kecil berantakin indomaret iyaiya aku resin,MYMEMORY WARNING: YOU USED ALL AVAILABLE FREE TRANSLATIONS FOR TODAY. NEXT AVAILABLE IN  03 HOURS 47 MINUTES 07 SECONDS VISIT HTTPS://MYMEMORY.TRANSLATED.NET/DOC/USAGELIMITS.PHP TO TRANSLATE MORE
233,potret giat persoiinil polsek teluk betung selatan polresta bandar lampung uiinit patroli samapta uiinit lantas laksana patroli dialogis kamtibmas karyawan tempat bela juru parkir alfamart indomaret tempat jalan yos sudarso kel bumi waras,MYMEMORY WARNING: YOU USED ALL AVAILABLE FREE TRANSLATIONS FOR TODAY. NEXT AVAILABLE IN  03 HOURS 47 MINUTES 06 SECONDS VISIT HTTPS://MYMEMORY.TRANSLATED.NET/DOC/USAGELIMITS.PHP TO TRANSLATE MORE
234,iini gd jastip indomaret ap mau sen alfagift lama,MYMEMORY WARNING: YOU USED ALL AVAILABLE FREE TRANSLATIONS FOR TODAY. NEXT AVAILABLE IN  03 HOURS 47 MINUTES 05 SECONDS VISIT HTTPS://MYMEMORY.TRANSLATED.NET/DOC/USAGELIMITS.PHP TO TRANSLATE MORE
235,sumpah hujan jalan indomaret nasib banget ggg,MYMEMORY WARNING: YOU USED ALL AVAILABLE FREE TRANSLATIONS FOR TODAY. NEXT AVAILABLE IN  03 HOURS 47 MINUTES 05 SECONDS VISIT HTTPS://MYMEMORY.TRANSLATED.NET/DOC/USAGELIMITS.PHP TO TRANSLATE MORE
236,really waktu project menara mandiri jg kelar sana sering duduk bangku depan tower merhatiin kendara lalulalang minum air mineral beli indomaret aja udah jadi lepas penat kok,MYMEMORY WARNING: YOU USED ALL AVAILABLE FREE TRANSLATIONS FOR TODAY. NEXT AVAILABLE IN  03 HOURS 47 MINUTES 04 SECONDS VISIT HTTPS://MYMEMORY.TRANSLATED.NET/DOC/USAGELIMITS.PHP TO TRANSLATE MORE
237,indomaret bakal jadi base nya carat,MYMEMORY WARNING: YOU USED ALL AVAILABLE FREE TRANSLATIONS FOR TODAY. NEXT AVAILABLE IN  03 HOURS 47 MINUTES 03 SECONDS VISIT HTTPS://MYMEMORY.TRANSLATED.NET/DOC/USAGELIMITS.PHP TO TRANSLATE MORE
238,ehh kemarin aku beli mogu rasa strawberry sama croissant rasa blueberry cuma 19k an cok beli indomaret sih masa beda harga jauh bangt,MYMEMORY WARNING: YOU USED ALL AVAILABLE FREE TRANSLATIONS FOR TODAY. NEXT AVAILABLE IN  03 HOURS 47 MINUTES 02 SECONDS VISIT HTTPS://MYMEMORY.TRANSLATED.NET/DOC/USAGELIMITS.PHP TO TRANSLATE MORE
239,lihat2 doang beli kagak kalo mau ngadem indomaret aja,MYMEMORY WARNING: YOU USED ALL AVAILABLE FREE TRANSLATIONS FOR TODAY. NEXT AVAILABLE IN  03 HOURS 47 MINUTES 02 SECONDS VISIT HTTPS://MYMEMORY.TRANSLATED.NET/DOC/USAGELIMITS.PHP TO TRANSLATE MORE
240,sayae dulu tiap bolos st gambir trus beli cemilan indomaret point cemilannya bawa buat nongkrong taman monas abis iseng galnas can relate wqwq kelas anak sma jajan cuma 20k laho,MYMEMORY WARNING: YOU USED ALL AVAILABLE FREE TRANSLATIONS FOR TODAY. NEXT AVAILABLE IN  03 HOURS 47 MINUTES 01 SECONDS VISIT HTTPS://MYMEMORY.TRANSLATED.NET/DOC/USAGELIMITS.PHP TO TRANSLATE MORE
241,katalog promo indomaret periode 12 26 juiini 2024 promo lengkap disiini gtgt,MYMEMORY WARNING: YOU USED ALL AVAILABLE FREE TRANSLATIONS FOR TODAY. NEXT AVAILABLE IN  03 HOURS 47 MINUTES 00 SECONDS VISIT HTTPS://MYMEMORY.TRANSLATED.NET/DOC/USAGELIMITS.PHP TO TRANSLATE MORE
242,tinggal indomaret,MYMEMORY WARNING: YOU USED ALL AVAILABLE FREE TRANSLATIONS FOR TODAY. NEXT AVAILABLE IN  03 HOURS 46 MINUTES 59 SECONDS VISIT HTTPS://MYMEMORY.TRANSLATED.NET/DOC/USAGELIMITS.PHP TO TRANSLATE MORE
243,aku kalo indomaret beli iini terus,MYMEMORY WARNING: YOU USED ALL AVAILABLE FREE TRANSLATIONS FOR TODAY. NEXT AVAILABLE IN  03 HOURS 46 MINUTES 59 SECONDS VISIT HTTPS://MYMEMORY.TRANSLATED.NET/DOC/USAGELIMITS.PHP TO TRANSLATE MORE
244,iini kaya pusing banget gr2 semalem ga nyadar waktu nonton gameplay bang windah saudara warnet indomaret and tiba2 jam 1 aja ir,MYMEMORY WARNING: YOU USED ALL AVAILABLE FREE TRANSLATIONS FOR TODAY. NEXT AVAILABLE IN  03 HOURS 46 MINUTES 58 SECONDS VISIT HTTPS://MYMEMORY.TRANSLATED.NET/DOC/USAGELIMITS.PHP TO TRANSLATE MORE
245,antara grup collab sama brand zioiinis si bong pilih collab sama brand lokal indomaret alfamart isi bong,MYMEMORY WARNING: YOU USED ALL AVAILABLE FREE TRANSLATIONS FOR TODAY. NEXT AVAILABLE IN  03 HOURS 46 MINUTES 57 SECONDS VISIT HTTPS://MYMEMORY.TRANSLATED.NET/DOC/USAGELIMITS.PHP TO TRANSLATE MORE
246,aku pernah ir sen grab aku blg aku nunggu indomaretnya pdhl grab ngumpul indomaret aku denger ko hp salah dariiver nya keluar suara pesan masuk gitu anteng aja ir ngudud ngopi ku ssampairin aja akhir gas jalan,MYMEMORY WARNING: YOU USED ALL AVAILABLE FREE TRANSLATIONS FOR TODAY. NEXT AVAILABLE IN  03 HOURS 46 MINUTES 56 SECONDS VISIT HTTPS://MYMEMORY.TRANSLATED.NET/DOC/USAGELIMITS.PHP TO TRANSLATE MORE
247,ngentott baru pulang acara kelulus terus mampir indomaret bentar malah diteriakin sama anak sma mau kondangan mana teh ketawa ketawa bajingann sdm rendah babi,MYMEMORY WARNING: YOU USED ALL AVAILABLE FREE TRANSLATIONS FOR TODAY. NEXT AVAILABLE IN  03 HOURS 46 MINUTES 56 SECONDS VISIT HTTPS://MYMEMORY.TRANSLATED.NET/DOC/USAGELIMITS.PHP TO TRANSLATE MORE
248,saham indomaret sekali,MYMEMORY WARNING: YOU USED ALL AVAILABLE FREE TRANSLATIONS FOR TODAY. NEXT AVAILABLE IN  03 HOURS 46 MINUTES 55 SECONDS VISIT HTTPS://MYMEMORY.TRANSLATED.NET/DOC/USAGELIMITS.PHP TO TRANSLATE MORE
249,magang indomaret kena rugi berapa abng,MYMEMORY WARNING: YOU USED ALL AVAILABLE FREE TRANSLATIONS FOR TODAY. NEXT AVAILABLE IN  03 HOURS 46 MINUTES 54 SECONDS VISIT HTTPS://MYMEMORY.TRANSLATED.NET/DOC/USAGELIMITS.PHP TO TRANSLATE MORE
250,dekat indomaret kemantran jl garuda,MYMEMORY WARNING: YOU USED ALL AVAILABLE FREE TRANSLATIONS FOR TODAY. NEXT AVAILABLE IN  03 HOURS 46 MINUTES 53 SECONDS VISIT HTTPS://MYMEMORY.TRANSLATED.NET/DOC/USAGELIMITS.PHP TO TRANSLATE MORE
251,cuma bingung makenya masa naik turun parking zone ga fleksibel kalo indomaret naik beam trus nyambung bis gimana,MYMEMORY WARNING: YOU USED ALL AVAILABLE FREE TRANSLATIONS FOR TODAY. NEXT AVAILABLE IN  03 HOURS 46 MINUTES 52 SECONDS VISIT HTTPS://MYMEMORY.TRANSLATED.NET/DOC/USAGELIMITS.PHP TO TRANSLATE MORE
252,betol tinggal jalan kaki sekali indomaret,MYMEMORY WARNING: YOU USED ALL AVAILABLE FREE TRANSLATIONS FOR TODAY. NEXT AVAILABLE IN  03 HOURS 46 MINUTES 52 SECONDS VISIT HTTPS://MYMEMORY.TRANSLATED.NET/DOC/USAGELIMITS.PHP TO TRANSLATE MORE
253,kalau kaya giini mah seluruh duiinia sama pubelic space free kalo jajan sendiri2 solusi bawa bekal rumah sekitar taman kadang indomaret kok beli dulu situ jajan murah2,MYMEMORY WARNING: YOU USED ALL AVAILABLE FREE TRANSLATIONS FOR TODAY. NEXT AVAILABLE IN  03 HOURS 46 MINUTES 51 SECONDS VISIT HTTPS://MYMEMORY.TRANSLATED.NET/DOC/USAGELIMITS.PHP TO TRANSLATE MORE
254,numpang ngadem indomaret,MYMEMORY WARNING: YOU USED ALL AVAILABLE FREE TRANSLATIONS FOR TODAY. NEXT AVAILABLE IN  03 HOURS 46 MINUTES 50 SECONDS VISIT HTTPS://MYMEMORY.TRANSLATED.NET/DOC/USAGELIMITS.PHP TO TRANSLATE MORE
255,bengong depan indomaret,MYMEMORY WARNING: YOU USED ALL AVAILABLE FREE TRANSLATIONS FOR TODAY. NEXT AVAILABLE IN  03 HOURS 46 MINUTES 49 SECONDS VISIT HTTPS://MYMEMORY.TRANSLATED.NET/DOC/USAGELIMITS.PHP TO TRANSLATE MORE
256,siang hari haus mampir indomaret beli minum lalu duduk depan ehhh mobil nyala iinih depan persis ngelirik dikit orang apa engga bayang bayang taunyaaaa jengjengjeng wkwkwkwk,MYMEMORY WARNING: YOU USED ALL AVAILABLE FREE TRANSLATIONS FOR TODAY. NEXT AVAILABLE IN  03 HOURS 46 MINUTES 49 SECONDS VISIT HTTPS://MYMEMORY.TRANSLATED.NET/DOC/USAGELIMITS.PHP TO TRANSLATE MORE
257,promosi hadiah indomaret 1226 juiini 2024,MYMEMORY WARNING: YOU USED ALL AVAILABLE FREE TRANSLATIONS FOR TODAY. NEXT AVAILABLE IN  03 HOURS 46 MINUTES 48 SECONDS VISIT HTTPS://MYMEMORY.TRANSLATED.NET/DOC/USAGELIMITS.PHP TO TRANSLATE MORE
258,indonesia panas indomaret dingin,MYMEMORY WARNING: YOU USED ALL AVAILABLE FREE TRANSLATIONS FOR TODAY. NEXT AVAILABLE IN  03 HOURS 46 MINUTES 47 SECONDS VISIT HTTPS://MYMEMORY.TRANSLATED.NET/DOC/USAGELIMITS.PHP TO TRANSLATE MORE
259,butuh doy cabang indon voucher kopi indomaret points oke kakdoy,MYMEMORY WARNING: YOU USED ALL AVAILABLE FREE TRANSLATIONS FOR TODAY. NEXT AVAILABLE IN  03 HOURS 46 MINUTES 46 SECONDS VISIT HTTPS://MYMEMORY.TRANSLATED.NET/DOC/USAGELIMITS.PHP TO TRANSLATE MORE
260,keburu gak mood gegara berapa balik indomaret zonk,MYMEMORY WARNING: YOU USED ALL AVAILABLE FREE TRANSLATIONS FOR TODAY. NEXT AVAILABLE IN  03 HOURS 46 MINUTES 45 SECONDS VISIT HTTPS://MYMEMORY.TRANSLATED.NET/DOC/USAGELIMITS.PHP TO TRANSLATE MORE
261,promo harga khusus member indomaret periode 1226 juiini 2024,MYMEMORY WARNING: YOU USED ALL AVAILABLE FREE TRANSLATIONS FOR TODAY. NEXT AVAILABLE IN  03 HOURS 46 MINUTES 45 SECONDS VISIT HTTPS://MYMEMORY.TRANSLATED.NET/DOC/USAGELIMITS.PHP TO TRANSLATE MORE
262,total paling cuman 18k asli soal khatam seluruh harga jajan indomaret km balik pla,MYMEMORY WARNING: YOU USED ALL AVAILABLE FREE TRANSLATIONS FOR TODAY. NEXT AVAILABLE IN  03 HOURS 46 MINUTES 44 SECONDS VISIT HTTPS://MYMEMORY.TRANSLATED.NET/DOC/USAGELIMITS.PHP TO TRANSLATE MORE
263,dapat bagai produk kategori makan amp minum hemat indomaret lama periode 12 26 juiini 2024 info lengkap,MYMEMORY WARNING: YOU USED ALL AVAILABLE FREE TRANSLATIONS FOR TODAY. NEXT AVAILABLE IN  03 HOURS 46 MINUTES 43 SECONDS VISIT HTTPS://MYMEMORY.TRANSLATED.NET/DOC/USAGELIMITS.PHP TO TRANSLATE MORE
264,lah murah banget td liat indomaret 68rb kotak kecil hiks,MYMEMORY WARNING: YOU USED ALL AVAILABLE FREE TRANSLATIONS FOR TODAY. NEXT AVAILABLE IN  03 HOURS 46 MINUTES 42 SECONDS VISIT HTTPS://MYMEMORY.TRANSLATED.NET/DOC/USAGELIMITS.PHP TO TRANSLATE MORE
265,b0kep pacar abg turut enak di3we anal ukhti vicoletta indomaret 3 rasa segera meiinikmati 184 hujan iinih si doi mulai ngajakin,MYMEMORY WARNING: YOU USED ALL AVAILABLE FREE TRANSLATIONS FOR TODAY. NEXT AVAILABLE IN  03 HOURS 46 MINUTES 42 SECONDS VISIT HTTPS://MYMEMORY.TRANSLATED.NET/DOC/USAGELIMITS.PHP TO TRANSLATE MORE
266,gila sekali jajan indomaret 80k wkwkwk buat butuh sih moga awet,MYMEMORY WARNING: YOU USED ALL AVAILABLE FREE TRANSLATIONS FOR TODAY. NEXT AVAILABLE IN  03 HOURS 46 MINUTES 41 SECONDS VISIT HTTPS://MYMEMORY.TRANSLATED.NET/DOC/USAGELIMITS.PHP TO TRANSLATE MORE
267,waktu pernah d klik indomaret pilih datang bukan pc stray kids,MYMEMORY WARNING: YOU USED ALL AVAILABLE FREE TRANSLATIONS FOR TODAY. NEXT AVAILABLE IN  03 HOURS 46 MINUTES 40 SECONDS VISIT HTTPS://MYMEMORY.TRANSLATED.NET/DOC/USAGELIMITS.PHP TO TRANSLATE MORE
268,takut zonk soal d indomaret deket2 siini bom,MYMEMORY WARNING: YOU USED ALL AVAILABLE FREE TRANSLATIONS FOR TODAY. NEXT AVAILABLE IN  03 HOURS 46 MINUTES 39 SECONDS VISIT HTTPS://MYMEMORY.TRANSLATED.NET/DOC/USAGELIMITS.PHP TO TRANSLATE MORE
269,sih iini woi indomaret x ah ba in sama bong ntar,MYMEMORY WARNING: YOU USED ALL AVAILABLE FREE TRANSLATIONS FOR TODAY. NEXT AVAILABLE IN  03 HOURS 46 MINUTES 38 SECONDS VISIT HTTPS://MYMEMORY.TRANSLATED.NET/DOC/USAGELIMITS.PHP TO TRANSLATE MORE
